{
  "$schema": "https://json-schema.org/draft/2020-12/schema",
  "$id": "https://local.skills/technical-planning/ready-plan.schema.json",
  "title": "ready-plan/v1 handoff",
  "type": "object",
  "additionalProperties": false,
  "required": [
    "schema",
    "candidate",
    "approval",
    "planning_baseline",
    "primary_plan",
    "artifacts",
    "sources",
    "contract_index",
    "commands",
    "work_packages",
    "revision_impact"
  ],
  "properties": {
    "schema": {"const": "ready-plan/v1"},
    "candidate": {
      "type": "object",
      "additionalProperties": false,
      "required": ["revision", "payload_sha256"],
      "properties": {
        "revision": {"type": "string", "minLength": 1},
        "payload_sha256": {"$ref": "#/$defs/sha256"}
      }
    },
    "approval": {
      "type": "object",
      "additionalProperties": false,
      "required": ["status", "actor", "confirmed_at", "evidence"],
      "properties": {
        "status": {"enum": ["Candidate", "Ready"]},
        "actor": {"type": ["string", "null"]},
        "confirmed_at": {"type": ["string", "null"], "format": "date-time"},
        "evidence": {"type": ["string", "null"]}
      },
      "allOf": [
        {
          "if": {"properties": {"status": {"const": "Ready"}}},
          "then": {
            "properties": {
              "actor": {"type": "string", "minLength": 1},
              "confirmed_at": {"type": "string", "format": "date-time"},
              "evidence": {"type": "string", "minLength": 1}
            }
          },
          "else": {
            "properties": {
              "actor": {"type": "null"},
              "confirmed_at": {"type": "null"},
              "evidence": {"type": "null"}
            }
          }
        }
      ]
    },
    "planning_baseline": {
      "type": "object",
      "additionalProperties": false,
      "required": ["repo_id", "head_sha", "status_sha256"],
      "properties": {
        "repo_id": {"$ref": "#/$defs/sha256"},
        "head_sha": {"$ref": "#/$defs/gitSha"},
        "status_sha256": {"$ref": "#/$defs/sha256"}
      }
    },
    "primary_plan": {"$ref": "#/$defs/pathHash"},
    "artifacts": {
      "type": "array",
      "minItems": 2,
      "items": {"$ref": "#/$defs/artifact"}
    },
    "sources": {
      "type": "array",
      "minItems": 1,
      "items": {"$ref": "#/$defs/source"}
    },
    "contract_index": {
      "type": "array",
      "minItems": 1,
      "items": {"$ref": "#/$defs/contract"}
    },
    "commands": {
      "type": "array",
      "minItems": 1,
      "items": {"$ref": "#/$defs/command"}
    },
    "work_packages": {
      "type": "array",
      "minItems": 1,
      "items": {"$ref": "#/$defs/workPackage"}
    },
    "validation": {"$ref": "#/$defs/validationPlan"},
    "revision_impact": {
      "type": "object",
      "additionalProperties": false,
      "required": ["revision", "changes"],
      "properties": {
        "revision": {"type": "string", "minLength": 1},
        "changes": {
          "type": "array",
          "items": {
            "type": "object",
            "additionalProperties": false,
            "required": ["changed_ref", "scope", "affected_wp_refs"],
            "properties": {
              "changed_ref": {"$ref": "#/$defs/impactRef"},
              "scope": {"enum": ["wp-local", "global-baseline"]},
              "affected_wp_refs": {
                "type": "array",
                "minItems": 1,
                "items": {"$ref": "#/$defs/wpId"}
              }
            }
          }
        }
      }
    },
    "bug_context": {"$ref": "#/$defs/bugContext"}
  },
  "$defs": {
    "sha256": {"type": "string", "pattern": "^[a-f0-9]{64}$"},
    "gitSha": {"type": "string", "pattern": "^(?:[a-fA-F0-9]{40}|[a-fA-F0-9]{64})$"},
    "normalizedPath": {
      "type": "string",
      "minLength": 1,
      "pattern": "^(?:\\.|(?:(?!\\.{1,2}(?:/|$))[^/:\\\\]+)(?:/(?!(?:\\.{1,2})(?:/|$))[^/:\\\\]+)*/?)$"
    },
    "sourceLocation": {
      "anyOf": [
        {"$ref": "#/$defs/normalizedPath"},
        {"type": "string", "minLength": 1, "pattern": "^[A-Za-z][A-Za-z0-9+.-]+:[^\\s\\\\]+$"}
      ]
    },
    "srcId": {"type": "string", "pattern": "^SRC-[A-Za-z0-9][A-Za-z0-9._-]*$"},
    "wpId": {"type": "string", "pattern": "^WP-[A-Za-z0-9][A-Za-z0-9._-]*$"},
    "commandId": {"type": "string", "pattern": "^CMD-[A-Za-z0-9][A-Za-z0-9._-]*$"},
    "bugId": {"type": "string", "pattern": "^(?=.{7,64}$)bug-[a-z0-9]+(?:-[a-z0-9]+)*$"},
    "contractId": {
      "type": "string",
      "pattern": "^(BDD-FWK|BOOT|BDD|TEST|CMD|WP)-[A-Za-z0-9][A-Za-z0-9._-]*$"
    },
    "impactRef": {
      "type": "string",
      "pattern": "^(SRC|BDD-FWK|BOOT|BDD|TEST|CMD|WP|TD|MOD|SEAM|REQ|AC|CON|IMP)-[A-Za-z0-9][A-Za-z0-9._-]*$"
    },
    "pathHash": {
      "type": "object",
      "additionalProperties": false,
      "required": ["path", "sha256"],
      "properties": {
        "path": {"$ref": "#/$defs/normalizedPath"},
        "sha256": {"$ref": "#/$defs/sha256"}
      }
    },
    "artifact": {
      "type": "object",
      "additionalProperties": false,
      "required": ["path", "role", "approval_status", "sha256"],
      "properties": {
        "path": {"$ref": "#/$defs/normalizedPath"},
        "role": {"enum": ["primary", "supporting", "handoff"]},
        "approval_status": {"enum": ["Candidate", "Ready"]},
        "sha256": {"anyOf": [{"$ref": "#/$defs/sha256"}, {"type": "null"}]}
      },
      "allOf": [
        {
          "if": {"properties": {"role": {"const": "handoff"}}},
          "then": {"properties": {"sha256": {"type": "null"}}},
          "else": {"properties": {"sha256": {"$ref": "#/$defs/sha256"}}}
        }
      ]
    },
    "source": {
      "type": "object",
      "additionalProperties": false,
      "required": ["source_id", "kind", "location", "revision", "sha256", "plan_refs", "wp_refs"],
      "properties": {
        "source_id": {"$ref": "#/$defs/srcId"},
        "kind": {"enum": ["spec", "bug", "governance", "adr", "project", "platform", "contract", "supporting"]},
        "location": {"$ref": "#/$defs/sourceLocation"},
        "revision": {"type": "string", "minLength": 1},
        "sha256": {"$ref": "#/$defs/sha256"},
        "plan_refs": {"type": "array", "minItems": 1, "items": {"type": "string", "minLength": 1}},
        "wp_refs": {"type": "array", "minItems": 1, "items": {"$ref": "#/$defs/wpId"}}
      },
      "allOf": [
        {
          "if": {
            "required": ["kind"],
            "properties": {"kind": {"const": "bug"}}
          },
          "then": {
            "properties": {
              "location": {
                "type": "string",
                "pattern": "^docs/bugs/bug-[a-z0-9]+(?:-[a-z0-9]+)*/assessment-[1-9][0-9]*\\.json$"
              },
              "revision": {"type": "string", "pattern": "^[1-9][0-9]*$"}
            }
          }
        }
      ]
    },
    "contract": {
      "type": "object",
      "additionalProperties": false,
      "required": ["contract_id", "kind", "source_refs", "wp_refs"],
      "properties": {
        "contract_id": {"$ref": "#/$defs/contractId"},
        "kind": {"enum": ["bdd-framework", "bootstrap", "bdd-scenario", "inner-test", "command", "work-package"]},
        "source_refs": {"type": "array", "minItems": 1, "items": {"$ref": "#/$defs/srcId"}},
        "wp_refs": {"type": "array", "minItems": 1, "items": {"$ref": "#/$defs/wpId"}}
      }
    },
    "allowedWrite": {
      "type": "object",
      "additionalProperties": false,
      "required": ["path", "kind", "cleanup"],
      "properties": {
        "path": {"$ref": "#/$defs/normalizedPath"},
        "kind": {"enum": ["ignored", "temporary"]},
        "cleanup": {"type": "string", "minLength": 1}
      }
    },
    "externalEffect": {
      "type": "object",
      "additionalProperties": false,
      "required": ["target", "effect", "reversible", "authorization"],
      "properties": {
        "target": {"type": "string", "minLength": 1},
        "effect": {"type": "string", "minLength": 1},
        "reversible": {"type": "boolean"},
        "authorization": {"type": "string", "minLength": 1}
      }
    },
    "absenceEvidence": {
      "type": "object",
      "additionalProperties": false,
      "required": ["probe", "outcome", "source_ref"],
      "properties": {
        "probe": {"type": "string", "minLength": 1},
        "outcome": {"type": "string", "minLength": 1},
        "source_ref": {"$ref": "#/$defs/srcId"}
      }
    },
    "command": {
      "type": "object",
      "additionalProperties": false,
      "required": [
        "command_id",
        "purpose",
        "status",
        "cwd",
        "command",
        "environment_prerequisites",
        "timeout_seconds",
        "network_policy",
        "allowed_writes",
        "external_side_effects",
        "success_criteria",
        "completeness_criteria",
        "absence_evidence"
      ],
      "properties": {
        "command_id": {"$ref": "#/$defs/commandId"},
        "purpose": {"enum": ["bug-reproduction", "bdd-install", "bdd-discovery", "bdd-focused", "bdd-full", "bootstrap", "tdd-focused", "related", "build-full", "test-full", "governance", "ci"]},
        "status": {"enum": ["Observed", "Proposed"]},
        "cwd": {"$ref": "#/$defs/normalizedPath"},
        "command": {"type": "string", "minLength": 1},
        "environment_prerequisites": {"type": "array", "items": {"type": "string", "minLength": 1}},
        "timeout_seconds": {"type": "integer", "minimum": 1},
        "network_policy": {"enum": ["forbidden", "optional", "required"]},
        "allowed_writes": {"type": "array", "items": {"$ref": "#/$defs/allowedWrite"}},
        "external_side_effects": {"type": "array", "items": {"$ref": "#/$defs/externalEffect"}},
        "success_criteria": {"type": "array", "minItems": 1, "items": {"type": "string", "minLength": 1}},
        "completeness_criteria": {"type": "array", "minItems": 1, "items": {"type": "string", "minLength": 1}},
        "absence_evidence": {"type": "array", "items": {"$ref": "#/$defs/absenceEvidence"}}
      },
      "allOf": [
        {
          "if": {"properties": {"status": {"const": "Proposed"}}},
          "then": {"properties": {"absence_evidence": {"minItems": 1}}},
          "else": {"properties": {"absence_evidence": {"maxItems": 0}}}
        }
      ]
    },
    "workPackage": {
      "type": "object",
      "additionalProperties": false,
      "required": ["wp_id", "blocked_by", "contract_refs", "source_refs", "command_refs"],
      "properties": {
        "wp_id": {"$ref": "#/$defs/wpId"},
        "blocked_by": {"type": "array", "items": {"$ref": "#/$defs/wpId"}},
        "contract_refs": {"type": "array", "minItems": 1, "items": {"$ref": "#/$defs/contractId"}},
        "source_refs": {"type": "array", "minItems": 1, "items": {"$ref": "#/$defs/srcId"}},
        "command_refs": {"type": "array", "minItems": 1, "items": {"$ref": "#/$defs/commandId"}}
      }
    },
    "validationEnvironment": {
      "type": "object",
      "additionalProperties": false,
      "required": ["os", "python", "git", "tools"],
      "properties": {
        "os": {"type": "string", "minLength": 1},
        "python": {"type": "string", "minLength": 1},
        "git": {"type": "string", "minLength": 1},
        "tools": {
          "type": "array",
          "uniqueItems": true,
          "items": {"type": "string", "minLength": 1}
        }
      }
    },
    "validationObligation": {
      "type": "object",
      "additionalProperties": false,
      "required": ["obligation_id", "command_ref"],
      "properties": {
        "obligation_id": {"$ref": "#/$defs/commandId"},
        "command_ref": {"$ref": "#/$defs/commandId"}
      }
    },
    "coverageEdge": {
      "type": "object",
      "additionalProperties": false,
      "required": [
        "producer_command_ref",
        "covered_command_ref",
        "required_child_ids",
        "inventory"
      ],
      "properties": {
        "producer_command_ref": {"$ref": "#/$defs/commandId"},
        "covered_command_ref": {"$ref": "#/$defs/commandId"},
        "required_child_ids": {
          "type": "array",
          "minItems": 1,
          "uniqueItems": true,
          "items": {"type": "string", "minLength": 1}
        },
        "inventory": {"const": "complete"}
      }
    },
    "releaseRequirements": {
      "type": "object",
      "additionalProperties": false,
      "required": ["profile", "platforms", "hosted"],
      "properties": {
        "profile": {"const": "release"},
        "platforms": {
          "type": "array",
          "minItems": 1,
          "uniqueItems": true,
          "items": {"type": "string", "minLength": 1}
        },
        "hosted": {"type": "boolean"}
      }
    },
    "validationReusePolicy": {
      "type": "object",
      "additionalProperties": false,
      "required": ["terminal_only_paths", "executable_input_globs"],
      "properties": {
        "terminal_only_paths": {
          "type": "array",
          "minItems": 1,
          "uniqueItems": true,
          "items": {"type": "string", "minLength": 1}
        },
        "executable_input_globs": {
          "type": "array",
          "minItems": 1,
          "uniqueItems": true,
          "items": {"type": "string", "minLength": 1}
        }
      }
    },
    "validationPlan": {
      "type": "object",
      "additionalProperties": false,
      "required": [
        "schema",
        "profile",
        "target_environment",
        "required_obligations",
        "coverage_edges",
        "release_requirements",
        "reuse_policy"
      ],
      "properties": {
        "schema": {"const": "validation-plan/v1"},
        "profile": {"enum": ["local", "release"]},
        "target_environment": {"$ref": "#/$defs/validationEnvironment"},
        "required_obligations": {
          "type": "array",
          "minItems": 1,
          "items": {"$ref": "#/$defs/validationObligation"}
        },
        "coverage_edges": {
          "type": "array",
          "items": {"$ref": "#/$defs/coverageEdge"}
        },
        "release_requirements": {"$ref": "#/$defs/releaseRequirements"},
        "reuse_policy": {"$ref": "#/$defs/validationReusePolicy"}
      }
    },
    "bugAssessmentBinding": {
      "type": "object",
      "additionalProperties": false,
      "required": ["path", "sha256", "markdown_path", "markdown_sha256"],
      "properties": {
        "path": {"$ref": "#/$defs/normalizedPath"},
        "sha256": {"$ref": "#/$defs/sha256"},
        "markdown_path": {"$ref": "#/$defs/normalizedPath"},
        "markdown_sha256": {"$ref": "#/$defs/sha256"}
      }
    },
    "partialSafeguards": {
      "type": "object",
      "additionalProperties": false,
      "required": ["reason", "proxy_bdd_refs", "proxy_test_refs", "residual_risks", "follow_up"],
      "properties": {
        "reason": {"oneOf": [{"type": "string", "minLength": 1}, {"type": "null"}]},
        "proxy_bdd_refs": {"type": "array", "uniqueItems": true, "items": {"type": "string", "pattern": "^BDD-[A-Za-z0-9][A-Za-z0-9._-]*$"}},
        "proxy_test_refs": {"type": "array", "uniqueItems": true, "items": {"type": "string", "pattern": "^TEST-[A-Za-z0-9][A-Za-z0-9._-]*$"}},
        "residual_risks": {"type": "array", "uniqueItems": true, "items": {"type": "string", "minLength": 1}},
        "follow_up": {"type": "array", "uniqueItems": true, "items": {"type": "string", "minLength": 1}}
      }
    },
    "bugContext": {
      "type": "object",
      "additionalProperties": false,
      "required": [
        "bug_id",
        "assessment",
        "reproduction_status",
        "root_cause_status",
        "root_cause_confidence",
        "verification_target",
        "original_reproduction_command_ref",
        "regression_bdd_refs",
        "regression_test_refs",
        "partial_safeguards"
      ],
      "properties": {
        "bug_id": {"$ref": "#/$defs/bugId"},
        "assessment": {"$ref": "#/$defs/bugAssessmentBinding"},
        "reproduction_status": {"enum": ["reproduced", "intermittent", "not-reproduced", "not-attempted"]},
        "root_cause_status": {"enum": ["confirmed", "hypothesized", "unknown"]},
        "root_cause_confidence": {"enum": ["high", "medium", "low"]},
        "verification_target": {"enum": ["verified", "partial"]},
        "original_reproduction_command_ref": {"oneOf": [{"$ref": "#/$defs/commandId"}, {"type": "null"}]},
        "regression_bdd_refs": {"type": "array", "minItems": 1, "uniqueItems": true, "items": {"type": "string", "pattern": "^BDD-[A-Za-z0-9][A-Za-z0-9._-]*$"}},
        "regression_test_refs": {"type": "array", "minItems": 1, "uniqueItems": true, "items": {"type": "string", "pattern": "^TEST-[A-Za-z0-9][A-Za-z0-9._-]*$"}},
        "partial_safeguards": {"$ref": "#/$defs/partialSafeguards"}
      }
    }
  },
  "x-required-command-purposes": ["bdd-discovery", "bdd-focused", "bdd-full", "tdd-focused", "related", "build-full", "test-full"]
}
