{
  "schema": "ready-plan/v1",
  "candidate": {
    "revision": "candidate-1",
    "payload_sha256": "f6de387be27e99e9cb844ea1804cbbce6374f5932c96aea6351cba37620c35c1"
  },
  "approval": {
    "status": "Ready",
    "actor": "user",
    "confirmed_at": "2026-09-15T05:30:00Z",
    "evidence": "user-prompt:PLEASE-IMPLEMENT-THIS-PLAN"
  },
  "planning_baseline": {
    "repo_id": "c02a0b6fa293bdbf99be435da6898d63abd509d25d61bdc9b4409ea9b8210b99",
    "head_sha": "a164d416d32ff3e8ea06d91afd7f960258bbd8c2",
    "status_sha256": "e3b0c44298fc1c149afbf4c8996fb92427ae41e4649b934ca495991b7852b855"
  },
  "primary_plan": {
    "path": "docs/work/work-20260915-sdlc-transformation-v2-delivery/plan/plan.md",
    "sha256": "78b52046c988d036c32bead1405c6dd0ed09043899b49168a4beb70ed16159db"
  },
  "artifacts": [
    {
      "path": "docs/work/work-20260915-sdlc-transformation-v2-delivery/plan/plan.md",
      "role": "primary",
      "approval_status": "Ready",
      "sha256": "78b52046c988d036c32bead1405c6dd0ed09043899b49168a4beb70ed16159db"
    },
    {
      "path": "docs/work/work-20260915-sdlc-transformation-v2-delivery/plan/handoff.json",
      "role": "handoff",
      "approval_status": "Ready",
      "sha256": null
    }
  ],
  "sources": [
    {
      "source_id": "SRC-REQ-001",
      "kind": "spec",
      "location": "docs/work/work-20260915-sdlc-transformation-v2-delivery/requirements.md",
      "revision": "1",
      "sha256": "679291164865be606e06cd2f3c0903eec33888565a573fef80157bd3a2369b42",
      "plan_refs": [
        "REQ-001"
      ],
      "wp_refs": [
        "WP-001"
      ]
    }
  ],
  "contract_index": [
    {
      "contract_id": "BDD-FWK-001",
      "kind": "bdd-framework",
      "source_refs": [
        "SRC-REQ-001"
      ],
      "wp_refs": [
        "WP-001"
      ]
    },
    {
      "contract_id": "BDD-001",
      "kind": "bdd-scenario",
      "source_refs": [
        "SRC-REQ-001"
      ],
      "wp_refs": [
        "WP-001"
      ]
    },
    {
      "contract_id": "TEST-001",
      "kind": "inner-test",
      "source_refs": [
        "SRC-REQ-001"
      ],
      "wp_refs": [
        "WP-001"
      ]
    },
    {
      "contract_id": "WP-001",
      "kind": "work-package",
      "source_refs": [
        "SRC-REQ-001"
      ],
      "wp_refs": [
        "WP-001"
      ]
    },
    {
      "contract_id": "CMD-BDD-DISCOVERY-001",
      "kind": "command",
      "source_refs": [
        "SRC-REQ-001"
      ],
      "wp_refs": [
        "WP-001"
      ]
    },
    {
      "contract_id": "CMD-BDD-FOCUSED-001",
      "kind": "command",
      "source_refs": [
        "SRC-REQ-001"
      ],
      "wp_refs": [
        "WP-001"
      ]
    },
    {
      "contract_id": "CMD-BDD-FULL-001",
      "kind": "command",
      "source_refs": [
        "SRC-REQ-001"
      ],
      "wp_refs": [
        "WP-001"
      ]
    },
    {
      "contract_id": "CMD-TDD-FOCUSED-001",
      "kind": "command",
      "source_refs": [
        "SRC-REQ-001"
      ],
      "wp_refs": [
        "WP-001"
      ]
    },
    {
      "contract_id": "CMD-RELATED-001",
      "kind": "command",
      "source_refs": [
        "SRC-REQ-001"
      ],
      "wp_refs": [
        "WP-001"
      ]
    },
    {
      "contract_id": "CMD-BUILD-FULL-001",
      "kind": "command",
      "source_refs": [
        "SRC-REQ-001"
      ],
      "wp_refs": [
        "WP-001"
      ]
    },
    {
      "contract_id": "CMD-TEST-FULL-001",
      "kind": "command",
      "source_refs": [
        "SRC-REQ-001"
      ],
      "wp_refs": [
        "WP-001"
      ]
    }
  ],
  "commands": [
    {
      "command_id": "CMD-BDD-DISCOVERY-001",
      "purpose": "bdd-discovery",
      "status": "Observed",
      "cwd": ".",
      "command": "tool bdd-discovery",
      "environment_prerequisites": [],
      "timeout_seconds": 30,
      "network_policy": "forbidden",
      "allowed_writes": [],
      "external_side_effects": [],
      "success_criteria": [
        "exit 0"
      ],
      "completeness_criteria": [
        "inventory complete"
      ],
      "absence_evidence": []
    },
    {
      "command_id": "CMD-BDD-FOCUSED-001",
      "purpose": "bdd-focused",
      "status": "Observed",
      "cwd": ".",
      "command": "tool bdd-focused",
      "environment_prerequisites": [],
      "timeout_seconds": 30,
      "network_policy": "forbidden",
      "allowed_writes": [],
      "external_side_effects": [],
      "success_criteria": [
        "exit 0"
      ],
      "completeness_criteria": [
        "inventory complete"
      ],
      "absence_evidence": []
    },
    {
      "command_id": "CMD-BDD-FULL-001",
      "purpose": "bdd-full",
      "status": "Observed",
      "cwd": ".",
      "command": "tool bdd-full",
      "environment_prerequisites": [],
      "timeout_seconds": 30,
      "network_policy": "forbidden",
      "allowed_writes": [],
      "external_side_effects": [],
      "success_criteria": [
        "exit 0"
      ],
      "completeness_criteria": [
        "inventory complete"
      ],
      "absence_evidence": []
    },
    {
      "command_id": "CMD-TDD-FOCUSED-001",
      "purpose": "tdd-focused",
      "status": "Observed",
      "cwd": ".",
      "command": "tool tdd-focused",
      "environment_prerequisites": [],
      "timeout_seconds": 30,
      "network_policy": "forbidden",
      "allowed_writes": [],
      "external_side_effects": [],
      "success_criteria": [
        "exit 0"
      ],
      "completeness_criteria": [
        "inventory complete"
      ],
      "absence_evidence": []
    },
    {
      "command_id": "CMD-RELATED-001",
      "purpose": "related",
      "status": "Observed",
      "cwd": ".",
      "command": "tool related",
      "environment_prerequisites": [],
      "timeout_seconds": 30,
      "network_policy": "forbidden",
      "allowed_writes": [],
      "external_side_effects": [],
      "success_criteria": [
        "exit 0"
      ],
      "completeness_criteria": [
        "inventory complete"
      ],
      "absence_evidence": []
    },
    {
      "command_id": "CMD-BUILD-FULL-001",
      "purpose": "build-full",
      "status": "Observed",
      "cwd": ".",
      "command": "tool build-full",
      "environment_prerequisites": [],
      "timeout_seconds": 30,
      "network_policy": "forbidden",
      "allowed_writes": [],
      "external_side_effects": [],
      "success_criteria": [
        "exit 0"
      ],
      "completeness_criteria": [
        "inventory complete"
      ],
      "absence_evidence": []
    },
    {
      "command_id": "CMD-TEST-FULL-001",
      "purpose": "test-full",
      "status": "Observed",
      "cwd": ".",
      "command": "tool test-full",
      "environment_prerequisites": [],
      "timeout_seconds": 30,
      "network_policy": "forbidden",
      "allowed_writes": [],
      "external_side_effects": [],
      "success_criteria": [
        "exit 0"
      ],
      "completeness_criteria": [
        "inventory complete"
      ],
      "absence_evidence": []
    }
  ],
  "work_packages": [
    {
      "wp_id": "WP-001",
      "blocked_by": [],
      "contract_refs": [
        "BDD-FWK-001",
        "BDD-001",
        "TEST-001",
        "WP-001",
        "CMD-BDD-DISCOVERY-001",
        "CMD-BDD-FOCUSED-001",
        "CMD-BDD-FULL-001",
        "CMD-TDD-FOCUSED-001",
        "CMD-RELATED-001",
        "CMD-BUILD-FULL-001",
        "CMD-TEST-FULL-001"
      ],
      "source_refs": [
        "SRC-REQ-001"
      ],
      "command_refs": [
        "CMD-BDD-DISCOVERY-001",
        "CMD-BDD-FOCUSED-001",
        "CMD-BDD-FULL-001",
        "CMD-TDD-FOCUSED-001",
        "CMD-RELATED-001",
        "CMD-BUILD-FULL-001",
        "CMD-TEST-FULL-001"
      ]
    }
  ],
  "revision_impact": {
    "revision": "candidate-1",
    "changes": [
      {
        "changed_ref": "BDD-001",
        "scope": "wp-local",
        "affected_wp_refs": [
          "WP-001"
        ]
      }
    ]
  }
}
